<?xml version="1.0" encoding="utf-8"?>
<xs:schema id="ex_5_17" elementFormDefault="qualified"
           xmlns:xs="http://www.w3.org/2001/XMLSchema">
    <xs:element name="booklist">
        <xs:complexType>
            <xs:sequence>
                <xs:element name="book" maxOccurs="unbounded">
                    <xs:complexType>
                        <xs:sequence>
                            <xs:element name="ISBN" type="xs:string"/>
                            <xs:element name="title" type="xs:string"/>
                            <xs:element name="authorlist" minOccurs="1">
                                <xs:complexType>
                                    <xs:sequence>
                                        <xs:element name="author" type="xs:string" maxOccurs="5"/>
                                    </xs:sequence>
                                </xs:complexType>
                            </xs:element>
                            <xs:element name="price" type="xs:decimal"/>
                        </xs:sequence>
                        <xs:attribute name="classify" use="required">
                            <xs:simpleType>
                                <xs:restriction base="xs:string">
                                    <xs:enumeration value="社会科学"/>
                                    <xs:enumeration value="自然科学"/>
                                </xs:restriction>
                            </xs:simpleType>
                        </xs:attribute>
                    </xs:complexType>
                </xs:element>
            </xs:sequence>
        </xs:complexType>
    </xs:element>
</xs:schema>